aplc1,aplr174,D,ex306,60,Site address on a firm woman.
aplc2,aplr502,P,ex205,30,Lawyer reach represent mission city.
aplc3,aplr205,D,ex270,60,Ok participant require record well.
aplc4,aplr254,D,ex94,60,Generation hit specific certainly.
aplc5,aplr531,C,ex341,90,Nice safe value name.
aplc6,aplr864,C,ex232,90,Bring author level realize.
aplc7,aplr371,D,ex237,30,Teach paper top many service fight.
aplc8,aplr16,D,ex362,30,Option parent hit television.
aplc9,aplr812,P,ex296,60,Form group leader model fund everybody goal visit.
aplc10,aplr561,P,ex272,30,These face explain student.
aplc11,aplr375,D,ex354,30,Staff discover hair establish term forget.
aplc12,aplr236,D,ex389,30,Partner guy clearly.
aplc13,aplr419,P,ex395,60,Give especially rest poor movie upon finish recent.
aplc14,aplr61,D,ex232,90,Respond agent along.
aplc15,aplr563,A,ex213,90,Arm when nice quality sit recent.
aplc16,aplr694,P,ex163,60,Much tend skin best laugh.
aplc17,aplr613,C,ex366,30,Beat until design need reduce radio respond.
aplc18,aplr455,C,ex301,60,Local represent line.
aplc19,aplr439,P,ex157,90,Let thought physical near boy inside television.
aplc20,aplr822,D,ex364,90,Boy send break.
aplc21,aplr540,P,ex215,90,Democratic method adult technology president.
aplc22,aplr609,A,ex60,60,Visit school next up develop special entire.
aplc23,aplr360,C,ex376,30,Specific involve see artist common public.
aplc24,aplr757,A,ex147,90,Lawyer soldier design save.
aplc25,aplr179,D,ex161,90,Among so site smile remember.
aplc26,aplr281,P,ex357,30,But time key difficult power parent test.
aplc27,aplr734,C,ex335,30,Television there history machine soon message key.
aplc28,aplr727,A,ex296,60,Respond chair represent direction can building.
aplc29,aplr77,C,ex32,30,Right determine behavior build.
aplc30,aplr103,A,ex235,90,Past movement far because bad.
aplc31,aplr121,A,ex23,30,Full capital computer.
aplc32,aplr834,D,ex239,90,Hold century field moment protect management offer.
aplc33,aplr164,P,ex94,60,Main democratic leader size different.
aplc34,aplr744,A,ex372,60,Environmental agency offer professor suggest outside task force.
aplc35,aplr433,D,ex197,60,Arrive left risk series by several mention expect.
aplc36,aplr438,A,ex10,30,Family early sure result former general.
aplc37,aplr526,D,ex5,30,Just lot particular explain foreign too civil customer.
aplc38,aplr914,C,ex387,30,Develop market audience former.
aplc39,aplr373,P,ex153,30,All character talk.
aplc40,aplr775,D,ex371,30,Serious while save resource vote work.
aplc41,aplr946,D,ex220,30,Ground bar then boy.
aplc42,aplr880,C,ex119,90,Work about fish factor unit financial.
aplc43,aplr604,C,ex208,30,Much recent window kind bed order impact.
aplc44,aplr631,P,ex193,90,Happy north similar professional life focus room.
aplc45,aplr58,D,ex136,90,Now still most trouble can.
aplc46,aplr988,P,ex180,60,Suffer experience million head rather.
aplc47,aplr286,A,ex113,30,President situation four rich sense able others.
aplc48,aplr933,C,ex65,60,Likely land but agree organization coach.
aplc49,aplr619,A,ex338,90,Per air event show.
aplc50,aplr833,D,ex240,30,Later parent at determine.
aplc51,aplr828,P,ex283,90,Night official box.
aplc52,aplr471,P,ex138,30,Change civil evening room three.
aplc53,aplr960,C,ex82,30,Beautiful focus throw.
aplc54,aplr578,A,ex89,90,Under necessary successful run hospital order in.
aplc55,aplr131,P,ex320,30,Growth pay customer candidate system create within.
aplc56,aplr187,D,ex138,30,Two among this unit history trial.
aplc57,aplr192,C,ex349,60,Some matter consumer president certain.
aplc58,aplr169,P,ex148,60,Though teacher capital hundred phone relate.
aplc59,aplr827,D,ex20,60,Some detail stop collection both.
aplc60,aplr791,A,ex49,60,Stock push capital training draw gun.
aplc61,aplr455,D,ex179,60,Maintain third have leave land team despite.
aplc62,aplr383,P,ex394,60,Site tell shoulder when.
aplc63,aplr654,A,ex301,60,South long politics explain property resource.
aplc64,aplr334,D,ex229,90,Cause spend boy response feel.
aplc65,aplr205,C,ex138,30,Start animal small reflect.
aplc66,aplr131,A,ex267,30,Draw wait prove world.
aplc67,aplr652,A,ex331,60,List argue section significant maybe parent ahead.
aplc68,aplr742,C,ex17,30,Modern share treatment listen lay reason.
aplc69,aplr494,P,ex170,90,Decide animal tell throw discussion.
aplc70,aplr512,D,ex69,30,That possible help.
aplc71,aplr853,C,ex35,90,Staff often charge present term remember live.
aplc72,aplr404,C,ex47,60,Sit suffer expert newspaper street evening system.
aplc73,aplr809,A,ex398,90,White time style.
aplc74,aplr767,P,ex375,60,Ability suffer wife series.
aplc75,aplr527,P,ex214,30,Relate manage pretty catch let so campaign.
aplc76,aplr970,C,ex112,90,Town song idea range.
aplc77,aplr930,A,ex103,30,Campaign player should do firm along able sign.
aplc78,aplr873,P,ex354,30,Firm mouth thousand will specific pass.
aplc79,aplr686,C,ex163,60,Appear ball begin again who still.
aplc80,aplr831,C,ex321,30,Degree administration customer business enough outside.
aplc81,aplr634,D,ex91,30,My particular few long back.
aplc82,aplr128,D,ex55,30,Performance water nature nothing cause nature.
aplc83,aplr419,D,ex388,30,Maybe military away group great spend.
aplc84,aplr827,P,ex183,60,Cut fact officer everybody hour stand.
aplc85,aplr540,P,ex63,30,Off house class deep fast end company.
aplc86,aplr540,P,ex68,90,Treatment blood space address.
aplc87,aplr428,C,ex305,90,Knowledge carry exist record poor your organization.
aplc88,aplr286,A,ex34,90,Art floor past appear.
aplc89,aplr800,C,ex322,30,Chance central course American new.
aplc90,aplr482,A,ex230,90,Value compare cover well.
aplc91,aplr609,P,ex394,60,Republican budget improve level brother poor need.
aplc92,aplr894,C,ex252,60,Growth become important activity few present.
aplc93,aplr461,A,ex28,30,Deal marriage maybe life.
aplc94,aplr960,A,ex155,30,Including begin company argue.
aplc95,aplr49,D,ex31,90,School why production view hour.
aplc96,aplr394,P,ex166,90,Forget treat age east.
aplc97,aplr603,A,ex351,60,Issue response trip defense.
aplc98,aplr220,P,ex356,60,Race doctor general well former.
aplc99,aplr92,C,ex295,30,Sell add about power.
aplc100,aplr792,D,ex255,60,Full no trip.
aplc101,aplr400,C,ex15,60,Everyone success strategy eight clearly.
aplc102,aplr466,A,ex56,30,Although teacher doctor record evidence final outside school.
aplc103,aplr22,C,ex398,90,Specific girl long thing wife.
aplc104,aplr395,A,ex135,90,Leave store production worker policy right far night.
aplc105,aplr90,D,ex327,90,Into activity two floor.
aplc106,aplr12,C,ex308,60,Important gas boy current.
aplc107,aplr536,D,ex229,90,Art growth feeling.
aplc108,aplr500,P,ex295,30,Moment challenge gas west everybody arm.
aplc109,aplr106,C,ex309,90,Level those full other life spend hard thousand.
aplc110,aplr465,C,ex331,60,Crime present party believe movie gun guess later.
aplc111,aplr517,P,ex85,60,Start and ten large.
aplc112,aplr975,C,ex293,90,Fine his fly owner company good up special.
aplc113,aplr266,D,ex360,60,Little fear TV wide prevent.
aplc114,aplr337,P,ex372,60,Series so goal another.
aplc115,aplr12,A,ex393,90,Wide national likely nothing exactly.
aplc116,aplr36,D,ex34,90,Road his talk sort.
aplc117,aplr774,D,ex389,30,Market relate safe because since whatever particular quality.
aplc118,aplr808,D,ex41,60,Activity difficult seem whole letter my.
aplc119,aplr933,P,ex183,60,Trip per car daughter general.
aplc120,aplr932,D,ex110,30,Increase back no none case.
aplc121,aplr717,P,ex200,90,Specific hope some my doctor travel.
aplc122,aplr615,D,ex219,30,Huge allow accept activity check professor.
aplc123,aplr944,C,ex251,30,Cover collection piece focus.
aplc124,aplr881,P,ex88,90,Top start ready billion light recognize agent.
aplc125,aplr87,C,ex320,30,Major name simply ago.
aplc126,aplr94,C,ex275,60,Get which player knowledge.
aplc127,aplr424,P,ex218,90,Beyond itself gas after address mind.
aplc128,aplr811,D,ex355,90,Through sport there four.
aplc129,aplr67,A,ex15,60,Government decision edge material two across.
aplc130,aplr927,D,ex160,30,Ahead special health international way.
aplc131,aplr706,D,ex91,30,Finally price property source everybody way seek.
aplc132,aplr969,C,ex146,60,Nation even big also newspaper produce prevent.
aplc133,aplr770,D,ex251,30,Realize car participant Congress crime fill successful catch.
aplc134,aplr702,A,ex322,30,Interesting help western.
aplc135,aplr736,C,ex296,60,Might summer forward rock.
aplc136,aplr74,P,ex92,60,Morning while crime mention.
aplc137,aplr692,A,ex118,60,Think argue contain possible.
aplc138,aplr10,C,ex309,90,Fund candidate pay wish they natural radio.
aplc139,aplr597,C,ex35,90,Oil feeling age wonder someone.
aplc140,aplr944,P,ex29,90,Relationship six item continue PM language family.
aplc141,aplr809,P,ex344,60,World thousand bit position us protect ahead.
aplc142,aplr210,A,ex137,60,Prepare difficult side girl option.
aplc143,aplr209,C,ex289,60,Shoulder right protect maintain car range executive.
aplc144,aplr721,A,ex124,90,Allow girl authority fast.
aplc145,aplr413,D,ex83,60,Degree relationship strong simple century health toward.
aplc146,aplr836,P,ex73,90,Reach room start audience discuss low.
aplc147,aplr596,P,ex153,30,Always foot from produce state before improve southern.
aplc148,aplr151,D,ex236,90,Into Republican throw already family staff.
aplc149,aplr933,C,ex364,90,Help chance send.
aplc150,aplr469,C,ex386,90,Wrong finish nice let score defense name.
aplc151,aplr865,D,ex189,30,Majority couple girl stage manager.
aplc152,aplr185,D,ex332,90,Ready stand check eight reason to.
aplc153,aplr176,C,ex46,30,Expect least ask store hot will see.
aplc154,aplr452,P,ex80,60,Couple manager point drug after our success effect.
aplc155,aplr434,D,ex248,60,Good plan certainly particular explain.
aplc156,aplr632,D,ex306,60,Paper management technology resource up send offer.
aplc157,aplr878,C,ex150,90,Personal strategy fine participant miss.
aplc158,aplr40,A,ex24,90,Also research though themselves music fast unit relationship.
aplc159,aplr613,D,ex368,90,Arm may top pull.
aplc160,aplr486,P,ex103,30,Glass big part yet.
aplc161,aplr822,P,ex347,30,Believe ball within none audience.
aplc162,aplr523,P,ex391,90,Speak deal security foot number son national.
aplc163,aplr936,C,ex135,90,Much before quality hold always.
aplc164,aplr505,A,ex273,90,Road use different medical really.
aplc165,aplr526,C,ex54,60,Cold real during tend avoid allow worker.
aplc166,aplr380,C,ex344,60,Sing push wonder area bit join.
aplc167,aplr588,A,ex149,30,Quite culture begin interview cost air deep reduce.
aplc168,aplr916,C,ex108,60,Morning possible national industry fine indeed.
aplc169,aplr827,C,ex400,30,Condition current authority hotel type her opportunity kid.
aplc170,aplr996,C,ex395,60,Or care help born.
aplc171,aplr130,P,ex115,60,Control trade example college order although my conference.
aplc172,aplr476,A,ex218,90,Include material once most.
aplc173,aplr548,D,ex254,90,Imagine kid level news.
aplc174,aplr155,A,ex222,90,Throughout same example election hear.
aplc175,aplr265,C,ex49,60,Less care practice look increase certainly.
aplc176,aplr512,P,ex311,60,Offer job beat bed late energy.
aplc177,aplr812,D,ex340,30,Pull high either structure.
aplc178,aplr104,A,ex349,60,Strategy country whether middle.
aplc179,aplr272,C,ex106,60,Suffer health leave include himself event by.
aplc180,aplr457,D,ex243,60,Keep increase recently school agent win family.
aplc181,aplr738,C,ex176,60,Success everything seven fast much.
aplc182,aplr88,A,ex302,30,Star produce crime teacher cover.
aplc183,aplr378,P,ex239,90,Others they change black.
aplc184,aplr61,P,ex317,90,Debate keep view while.
aplc185,aplr882,C,ex173,60,Store green myself instead high.
aplc186,aplr202,P,ex180,60,War maybe tax interest pressure wear.
aplc187,aplr346,C,ex246,30,Include through whether parent send material card environment.
aplc188,aplr371,P,ex128,60,Argue growth stock more she.
aplc189,aplr179,D,ex171,60,Begin capital reach gas several.
aplc190,aplr657,C,ex169,60,Each staff budget street traditional particularly simple.
aplc191,aplr301,P,ex128,60,So need everything action.
aplc192,aplr231,C,ex43,60,Hospital crime serious join choice wear.
aplc193,aplr205,D,ex66,30,Happen debate see.
aplc194,aplr774,P,ex103,30,Space choose whose director truth table law.
aplc195,aplr553,P,ex52,60,Ask career join social laugh it sort.
aplc196,aplr750,A,ex82,30,Short tough important anything enjoy then.
aplc197,aplr12,D,ex243,60,Everything leave hour director avoid.
aplc198,aplr350,P,ex201,30,Large one animal yourself.
aplc199,aplr120,D,ex67,30,Both fall international media space reveal.
aplc200,aplr133,C,ex353,30,Fly list service box south happy.
